{"$schema":"../schemas/entity_collection.schema.json","entities":[{"capabilities":["entity_scope","scenario_scope"],"data":{"consumes":[],"generates":[]},"designation":"logical","entity_class":"UseCase","entity_id":"UC4","interfaces":[],"lifecycle":{"allowed_states":["defined","configured","running","completed","failed"],"initial_state":"defined"},"location":"Model scope","name":"Lawful forensic investigation in a smart home for IoT-enabled crime","network_zones":[],"notes":"Canonical graph root for UC4","observability":"observable","owner_operator":"SALUS T4.3","parent_class":"SALUS_Entity","provenance":{"assumption_ids":["ASSUMPTION-UC4-001","ASSUMPTION-UC4-002"],"confidence":"high","record_status":"agreed_decision","source_references":["PROPOSAL-PDF-p169-p170","AGREED-UC4-001","AGREED-UC4-002"]},"retention_class":"configuration","role":"Bounds the agreed unauthorized-entry and sensor-tampering vertical slice","schema_version":"1.0.0","sensitivity":"High","use_case":"UC4"},{"capabilities":["occupancy_context","security_context"],"data":{"consumes":[],"generates":[]},"designation":"physical","entity_class":"PhysicalEnvironment","entity_id":"UC4-ENV01","interfaces":[{"direction":"bidirectional","kind":"simulation","name":"simulation_context","protocol":"internal-event","status":"abstract"}],"lifecycle":{"allowed_states":["unoccupied_armed","occupied_armed","occupied_disarmed","unoccupied_disarmed"],"initial_state":"unoccupied_armed"},"location":"Controlled smart-home premises","name":"Smart-home premises","network_zones":[],"notes":"Logical location only; no real address","observability":"partially_observable","owner_operator":"Resident or lab operator","parent_class":"Environment","provenance":{"assumption_ids":["ASSUMPTION-UC4-002","ASSUMPTION-UC4-026"],"confidence":"high","record_status":"agreed_decision","source_references":["PROPOSAL-PDF-p169-p170","AGREED-UC4-001"]},"retention_class":"scenario","role":"Bounds physical incident events","schema_version":"1.0.0","sensitivity":"High","use_case":"UC4"},{"capabilities":["internal_communication_boundary"],"data":{"consumes":[],"generates":[]},"designation":"logical","entity_class":"NetworkZone","entity_id":"UC4-NZ01","interfaces":[{"direction":"bidirectional","kind":"network","name":"home_lan","protocol":"TBD/abstract","status":"TBD"}],"lifecycle":{"allowed_states":["active","degraded","unavailable"],"initial_state":"active"},"location":"Smart-home network","name":"Home IoT LAN","network_zones":["UC4-NZ01"],"notes":"Exact topology is configurable","observability":"observable","owner_operator":"Resident or CPE operator","parent_class":"Environment","provenance":{"assumption_ids":["ASSUMPTION-UC4-003","ASSUMPTION-UC4-005"],"confidence":"medium","record_status":"proposed","source_references":["PROPOSAL-PDF-p169-p170"]},"retention_class":"configuration","role":"Carries internal IoT communications","schema_version":"1.0.0","sensitivity":"High","use_case":"UC4"},{"capabilities":["external_communication_boundary"],"data":{"consumes":[],"generates":[]},"designation":"logical","entity_class":"NetworkZone","entity_id":"UC4-NZ02","interfaces":[{"direction":"bidirectional","kind":"network","name":"wan","protocol":"TBD/abstract","status":"TBD"}],"lifecycle":{"allowed_states":["active","degraded","unavailable"],"initial_state":"active"},"location":"CPE external boundary","name":"WAN and Internet boundary","network_zones":["UC4-NZ02"],"notes":"Optional cloud communication disabled by default","observability":"observable","owner_operator":"CPE or ISP role","parent_class":"Environment","provenance":{"assumption_ids":["ASSUMPTION-UC4-005","ASSUMPTION-UC4-012"],"confidence":"medium","record_status":"proposed","source_references":["PROPOSAL-PDF-p169-p170"]},"retention_class":"configuration","role":"Bounds external communications","schema_version":"1.0.0","sensitivity":"High","use_case":"UC4"},{"capabilities":["secured_service_boundary","audited_access"],"data":{"consumes":[],"generates":[]},"designation":"logical","entity_class":"NetworkZone","entity_id":"UC4-NZ03","interfaces":[{"direction":"bidirectional","kind":"network","name":"lea_service_boundary","protocol":"TBD/abstract","status":"proposed"}],"lifecycle":{"allowed_states":["active","degraded","unavailable"],"initial_state":"active"},"location":"LEA infrastructure","name":"LEA secured environment","network_zones":["UC4-NZ03"],"notes":"Synthetic secured environment","observability":"fully_audited","owner_operator":"LEA","parent_class":"Environment","provenance":{"assumption_ids":["ASSUMPTION-UC4-014","ASSUMPTION-UC4-023"],"confidence":"medium","record_status":"proposed","source_references":["PROPOSAL-PDF-p163-p164","ROADMAP-Phase-5"]},"retention_class":"case_retention","role":"Hosts controlled forensic services","schema_version":"1.0.0","sensitivity":"Critical","use_case":"UC4"},{"capabilities":["routing","flow_metadata","bounded_buffer","scoped_acquisition"],"clock_domain":"cpe_clock","data":{"consumes":[],"generates":["UC4-DO02"]},"designation":"physical","entity_class":"Gateway","entity_id":"UC4-D01","interfaces":[{"direction":"bidirectional","kind":"network","name":"lan_wan","protocol":"TBD/abstract","status":"TBD"},{"direction":"out","kind":"application","name":"acquisition","protocol":"SALUS-acquisition-contract","status":"proposed"}],"lifecycle":{"allowed_states":["online","degraded","offline"],"initial_state":"online"},"location":"Smart-home network edge","name":"Open-source CPE router","network_zones":["UC4-NZ01","UC4-NZ02"],"notes":"Payload capture is disabled","observability":"observable","owner_operator":"Resident or CPE operator","parent_class":"Asset","provenance":{"assumption_ids":["ASSUMPTION-UC4-003","ASSUMPTION-UC4-004","ASSUMPTION-UC4-005","ASSUMPTION-UC4-006","ASSUMPTION-UC4-019","ASSUMPTION-UC4-031"],"confidence":"high","record_status":"proposal","source_references":["PROPOSAL-PDF-p169-p170","LEGACY-UC4-CPE-INVENTORY"]},"retention_class":"bounded_source","role":"Routes traffic and exposes controlled acquisition interface","schema_version":"1.0.0","sensitivity":"High","twin_id":"UC4-DT01","use_case":"UC4"},{"capabilities":["device_registry","state_store","event_log","automation"],"clock_domain":"home_assistant_clock","data":{"consumes":["UC4-DO04"],"generates":["UC4-DO03"]},"designation":"physical","entity_class":"GatewayServer","entity_id":"UC4-D02","interfaces":[{"direction":"bidirectional","kind":"application","name":"device_events","protocol":"TBD/abstract","status":"TBD"},{"direction":"out","kind":"application","name":"forensic_export","protocol":"SALUS-acquisition-contract","status":"proposed"}],"lifecycle":{"allowed_states":["online","degraded","offline"],"initial_state":"online"},"location":"Smart-home premises","name":"Home Assistant host","network_zones":["UC4-NZ01"],"notes":"Separate logical entity even if co-hosted","observability":"observable","owner_operator":"Resident or lab operator","parent_class":"Asset","provenance":{"assumption_ids":["ASSUMPTION-UC4-003","ASSUMPTION-UC4-004","ASSUMPTION-UC4-005","ASSUMPTION-UC4-007","ASSUMPTION-UC4-010","ASSUMPTION-UC4-031"],"confidence":"high","record_status":"proposal","source_references":["PROPOSAL-PDF-p169-p170"]},"retention_class":"bounded_source","role":"Maintains registry states event history and automation rules","schema_version":"1.0.0","sensitivity":"High","twin_id":"UC4-DT02","use_case":"UC4"},{"capabilities":["contact_state","heartbeat","optional_tamper"],"clock_domain":"door_sensor_clock","data":{"consumes":[],"generates":["UC4-DO04"]},"designation":"physical","entity_class":"Sensor","entity_id":"UC4-D03","interfaces":[{"direction":"out","kind":"application","name":"state_event","protocol":"TBD/abstract","status":"TBD"}],"lifecycle":{"allowed_states":["closed_online","open_online","tampered","offline"],"initial_state":"closed_online"},"location":"Monitored entrance","name":"Door and window contact sensor","network_zones":["UC4-NZ01"],"notes":"Tamper capability is configurable","observability":"partially_observable","owner_operator":"Resident or lab operator","parent_class":"Asset","provenance":{"assumption_ids":["ASSUMPTION-UC4-001","ASSUMPTION-UC4-004","ASSUMPTION-UC4-005","ASSUMPTION-UC4-008","ASSUMPTION-UC4-020"],"confidence":"high","record_status":"agreed_decision","source_references":["PROPOSAL-PDF-p169-p170","AGREED-UC4-001"]},"retention_class":"bounded_source","role":"Observes entrance state and is the primary tampered device","schema_version":"1.0.0","sensitivity":"High","twin_id":"UC4-DT03","use_case":"UC4"},{"capabilities":["presence_detection","heartbeat","quality_reporting"],"clock_domain":"presence_sensor_clock","data":{"consumes":[],"generates":["UC4-DO04"]},"designation":"physical","entity_class":"Sensor","entity_id":"UC4-D04","interfaces":[{"direction":"out","kind":"application","name":"state_event","protocol":"TBD/abstract","status":"TBD"}],"lifecycle":{"allowed_states":["clear_online","motion_online","offline"],"initial_state":"clear_online"},"location":"Interior monitored area","name":"Presence sensor","network_zones":["UC4-NZ01"],"notes":"Detection uncertainty is explicit","observability":"partially_observable","owner_operator":"Resident or lab operator","parent_class":"Asset","provenance":{"assumption_ids":["ASSUMPTION-UC4-004","ASSUMPTION-UC4-005","ASSUMPTION-UC4-009","ASSUMPTION-UC4-020"],"confidence":"high","record_status":"agreed_decision","source_references":["PROPOSAL-PDF-p169-p170","AGREED-UC4-001"]},"retention_class":"bounded_source","role":"Probabilistically corroborates movement","schema_version":"1.0.0","sensitivity":"High","twin_id":"UC4-DT04","use_case":"UC4"},{"capabilities":["power_switch","heartbeat","optional_power_measurement"],"clock_domain":"smart_plug_clock","data":{"consumes":["UC4-DO03"],"generates":["UC4-DO04"]},"designation":"physical","entity_class":"SensorActuator","entity_id":"UC4-D05","interfaces":[{"direction":"bidirectional","kind":"application","name":"command_state","protocol":"TBD/abs